{
  "relation_id": "REL-000004",
  "relation_type": "extends",
  "from_id": "SR-OBJ-000020",
  "to_id": "SR-OBJ-000009",
  "declared": "2026-09-13T18:00:00Z",
  "notes": "The First Seam-Chain Casepack states that it occupies the fifth rung of the casepack ladder directly after The First Welded Seam Casepack and that its burden is composition of the single welded seam that paper established."
}
