{
  "relation_id": "REL-000005",
  "relation_type": "extends",
  "from_id": "SR-OBJ-000029",
  "to_id": "SR-OBJ-000028",
  "declared": "2026-09-13T18:00:00Z",
  "notes": "Semester II states that its instructional burden is to make evaluation durable after Semester I has made evaluation possible (Weeks 15–28 follow Weeks 1–14 of the same Course Architecture v1.0)."
}
